{"object_id":"note_01JSTAG7N9Q3V5X8Y2Z4A6B8D0","path":"notes/ideas/example.md","checksum":"sha256:aaaaaaaaaaaaaaaaaaaaaaaaaaaaaaaaaaaaaaaaaaaaaaaaaaaaaaaaaaaaaaaa","object":{"schema_version":2,"id":"note_01JSTAG7N9Q3V5X8Y2Z4A6B8D0","kind":"note","note_type":"idea","title":"Example","visibility":"private","record_status":"active","maturity":"seed","created":"2026-08-26","updated":"2026-08-26","tags":[],"type_history":[]},"body":{"schema_version":2,"note_id":"note_01JSTAG7N9Q3V5X8Y2Z4A6B8D0","sections":[{"section_id":"sec_core_idea","role":"human","heading":"Core","blocks":[{"kind":"text","text":"Body"}]}]},"citations":[],"relations":{"outgoing":[],"incoming":[]}}
